{
  "schema_version": "covenant.producer-consumer-contract-digest-comparison.v1",
  "comparison_id": "ao-stack-month6-producer-consumer-contract-digest-comparison",
  "owner_repo": "ao-covenant",
  "status": "mismatch_detected_fail_closed",
  "source_recommendation_rank": 28,
  "source_recommendation_task": "Add producer consumer contract digest comparison fixture",
  "safety_gate": "planning_only_no_provider_no_release",
  "comparisons": [
    {
      "contract_id": "covenant.contract.v1",
      "owner_repo": "ao-covenant",
      "producer_repo": "ao-covenant",
      "consumer_repo": "ao-atlas",
      "producer_digest_sha256": "3ec5bdf64b96f14ad51eb3d0c74f519b866cd84f5193cf99ae3f2a957f851e55",
      "consumer_digest_sha256": "7b472d1eb47d74ff1f84cd76072f18dd33dae988772e1a3d337c6bdeb09d2445",
      "digest_match": false,
      "required_evidence": [
        "producer canonical schema digest",
        "consumer imported schema digest",
        "consumer fixture validation failure"
      ]
    },
    {
      "contract_id": "covenant.approval-ticket.v1",
      "owner_repo": "ao-covenant",
      "producer_repo": "ao-covenant",
      "consumer_repo": "ao-command",
      "producer_digest_sha256": "c8e8868627df5903a552f8dd24f55712296853a7b883a4c7b71537ce983e6888",
      "consumer_digest_sha256": "e35fa4c22cb5a70fa4a6718b6fe2d4fa8e2264a8a98fac0a151b15f9a3257ee1",
      "digest_match": false,
      "required_evidence": [
        "producer approval ticket digest",
        "consumer ticket parser digest",
        "command readback compatibility status"
      ]
    },
    {
      "contract_id": "covenant.schema-catalog-result.v1",
      "owner_repo": "ao-covenant",
      "producer_repo": "ao-covenant",
      "consumer_repo": "ao-architecture",
      "producer_digest_sha256": "c81a32bed65ce2d0ec9111549ea977b7d093a7e6bb791772d102ee1a0cbece15",
      "consumer_digest_sha256": "c81a32bed65ce2d0ec9111549ea977b7d093a7e6bb791772d102ee1a0cbece15",
      "digest_match": true,
      "required_evidence": [
        "producer schema catalog digest",
        "consumer architecture registry digest",
        "compatibility gate pass readback"
      ]
    }
  ],
  "comparison_count": 3,
  "mismatch_count": 2,
  "compatibility_gate_passed": false,
  "no_promotion_requested": true,
  "provider_calls_allowed": false,
  "credential_use_allowed": false,
  "release_or_publish_allowed": false,
  "claims_authority_advance": false,
  "policy_or_auth_widening": false,
  "hidden_instruction_change": false,
  "direct_main_mutation": false,
  "rsi_remains_denied": true
}
